id,Name,Type,Cuisine,Address,District,Rating,AveragePrice
D6 0008,Suon Cay Nuong & Hai San  Kinh Duong Vuong,Bistro,Korean,"99 Kinh Duong Vuong, P. 12",6,3.7,"110,000"
D6 0009,Funny Beef  Spaghetti & Beefsteak  Nguyen Van Luong,Bistro,Italian,"203C Nguyen Van Luong, P. 11",6,3.75,"60,000"
D6 0010,Sushi 107,Bistro,Japanese,"107 Duong So 10, P. 13",6,3.75,"57,500"
D6 0012,Ty Thy  Goi Du Du Thai,Bistro,Thailand,"2B Ben Phu Lam, P. 9",6,3.2,"32,500"
D6 0017,Gia Phu Phuc Kien  Am Thuc Trung Hoa,Restaurant,Chinese,"513/28 Gia Phu, P. 3",6,3.7,"190,000"
D6 0022,Le Castella Viet Nam  Banh Bong Lan Dai Loan  Hau Giang,Bakery,Taiwanese,"152 Hau Giang, P. 6",6,3.15,"65,000"
D6 0026,Mi Cay Gochu  Nguyen Van Luong,Bistro,Korean,"409 Nguyen Van Luong, P. 12",6,4.5,"40,000"
D6 0033,Ga Ran Popeyes  Nguyen Van Luong,Restaurant,USA,"500C Nguyen Van Luong, P. 12",6,3.25,"90,000"
D6 0038,Sasin  Mi Cay 7 Cap Do Han Quoc  Nguyen Van Luong,Bistro,Korean,"233A Nguyen Van Luong, P. 11",6,3.65,"85,000"
D6 0041,Che Thap Cam Phuc Linh,Bistro,Chinese,"200 Le Quang Sung, P. 6",6,3.65,"16,000"
D6 0052,Chi Dao Bao  Dimsum,Restaurant,Chinese,"97  99 Ly Chieu Hoang, P. 10",6,3.95,"125,000"
D6 0057,A Mao  Mi Sup Dai Loan  Gia Phu,Restaurant,Taiwanese,"Tang Tret, Chung Cu Viva, Cong 445 Gia Phu, P. 3",6,3.95,"37,000"
D6 0060,Chao Ech Singapore Miss Hana  Binh Phu,Bistro,Singapore,"87 Binh Phu, P. 11",6,4.05,"67,000"
D6 0066,Sushi Minh  Giao Hang Tan Noi  Hau Giang,Bistro,Japanese,"13 Hau Giang, P. 2",6,3.05,"107,500"
D6 0072,Bo Vien A Tat  Bo Vien Nhan Sot Hong Kong  Cao Van Lau,Bistro,Chinese,130 Cao Van Lau,6,4.65,"60,000"
D6 0074,TOUS les JOURS  Hau Giang,Cafe,Korean,"231 Hau Giang, P. 5",6,3.25,"307,500"
D6 0081,Sushi Vien Ong Chu Nho  70B Hau Giang,Restaurant,Japanese,"70B Hau Giang, P. 6",6,3.75,"85,500"
D6 0084,Quan Co Nam  Bo Kho & Bun Hen,Bistro,Thailand,166 Hau Giang,6,3.4,"57,500"
D6 0089,Yoko Sushi,Bistro,Japanese,"136 Duong So 10, Cu Xa Ra Da, P. 13",6,4,"44,500"
D6 0117,Sa Te Nai & Nai Kho  Tran Van Kieu,Bistro,Chinese,"164 Tran Van Kieu, P. 10",6,3.85,"45,000"
D6 0123,"An Vat Yumi  Mi Cay, Mi Goi Tron & Banh Trang Cuon",Bistro,Korean,"183/29G Tan Hoa Dong, P. 14",6,3.8,"30,500"
D6 0124,Tra Sua Feeling Tea  Tan Hoa Dong,Cafe,Asian,"23 Tan Hoa Dong, P. 13 (Gan Truong Hoc Mac Dinh Chi)",6,3.5,"30,000"
D6 0127,D&M Sushi  Duong So 10,Bistro,Japanese,"01R Duong So 10, P. 13",6,4,"12,000"
D6 0145,Namsan Tokbokki  Pham Hung,Restaurant,Korean,"199/9A Le Quang Sung, P. 6",6,3.8,"25,000"
D6 0153,Beeftex,Restaurant,USA,"1A Tan Hoa, P. 14",6,3.7,"210,000"
D6 0160,Tra Sua Tian Mi Mi,Bistro,Chinese,"79A Le Quang Sung, P. 2",6,4,"47,500"
D6 0169,Royaltea Hong Kong  Nguyen Van Luong,Cafe,Chinese,"135/4 Nguyen Van Luong, P. 10",6,3.35,"48,500"
D6 0179,Com Ga Hong Kong  Nguyen Van Luong,Bistro,Chinese,"135/4 Nguyen Van Luong, P. 10",6,3.1,"48,500"
D6 0192,Doyagi  Am Thuc Han Quoc,Bistro,Korean,"126 Duong So 10, Cu Xa Ra Da, P. 13",6,3.95,"39,000"
D6 0193,Chin Quan  Mi Tron Hongkong,Bistro,Chinese,"194 Nguyen Van Luong, P. 11",6,4,"35,000"
D6 0194,Michael Dimsum  Banh Cuon Hong Kong  Pham Phu Thu,Bistro,Chinese,"82 Pham Phu Thu, P. 3",6,3.15,"35,000"
D6 0208,Ha Cao Hong Kong  Hau Giang,Restaurant,Chinese,"92 Hau Giang, P. 6",6,3.7,"55,000"
D6 0217,Com Chao Trieu Chau 63,Bistro,Chinese,"683 Hong Bang, P. 5",6,3.6,"30,000"
D6 0221,Sentosa Food  Chao Ech Singapore  Hau Giang,Bistro,Singapore,120 Hau Giang,6,3.15,"52,500"
D6 0247,Bun Thai D25 Quan,Bistro,Thailand,"E30 Cu Xa Phu Lam B, P. 13",6,3.15,"30,000"
D6 0251,"Ut Huong  Hu Tieu Mi, Bo Kho, Tai Nam Gau Gan",Bistro,Chinese,24 Binh Phu,6,3.5,"32,500"
D6 0252,Hu Tieu Nam Vang Campuchia,Bistro,Cambodia,"Ngo Nhan Tinh, P. 2",6,3.6,"35,000"
D6 0257,Teng Teng  Taiwan Tea  Vo Van Kiet,Cafe,Taiwanese,"1398 Vo Van Kiet, P. 1",6,3.5,"27,500"
D6 0261,Com Ga Sot Japan,Bistro,Japanese,"87/17 Nguyen Pham Tuan, P. 9",6,3.75,"40,000"
D6 0282,Xoi Bat Buu,Restaurant,Chinese,"95A Ly Chieu Hoang, P. 10",6,3.25,"15,000"
D6 0290,Ong Soi  Sui Cao & Hu Tieu Mi,Bistro,Chinese,"116 Hau Giang, P. 6",6,3.25,"27,000"
D6 0296,Trai Cay Say Kho Thai Lan Online,Restaurant,Thailand,105 Minh Phung,6,4.1,"93,000"
D6 0310,Takoyaki & Banh Xeo,Restaurant,Japanese,165A Nguyen Van Luong,6,4.45,"18,500"
D6 0354,San Mama  Lau Dai Loan,Bistro,Taiwanese,159 Hau Giang,6,4.2,"87,000"
D6 0366,Sushi Oshio,Bistro,Japanese,"234E Nguyen Van Luong, P. 11",6,4.4,"204,000"
D6 0378,Life Tea  Tra Sua Dai Loan,Cafe,Taiwanese,"214 Nguyen Van Luong, P. 11",6,4.1,"17,500"
D6 0384,Chao Ech Singapore  Cu Xa Phu Lam B,Bistro,Singapore,"D33 Cu Xa Phu Lam B, P. 13",6,3.25,"60,000"
D6 0392,Ga Cay Pho Mai & An Vat Co Chu Nho,Bistro,Korean,"487B Hau Giang, P.11",6,3.65,"35,000"
D6 0393,Little Hongkong  Banh Trung Ga Non  Binh Phu,Restaurant,Chinese,"23 Binh Phu, P. 10",6,3.3,"17,500"
D6 0415,Com Ga Hai Nam  Hau Giang,Bistro,Chinese,"140 Hau Giang, P. 6",6,4.5,"73,000"
D6 0444,Han Quoc Quan  Lau Ga Nhan Sam & An Vat,Bistro,Korean,"219 Nguyen Van Luong, P. 11",6,4.85,"125,000"
D6 0466,Kem Cuon Fresh,Cafe,Thailand,"199/5 Le Quang Sung, P. 6",6,5,"15,000"
D6 0473,Tra Sua Pozaa Tea  Pham Van Chi,Cafe,Asian,"579/8 Pham Van Chi, P. 7",6,3.05,"35,000"
D6 0477,Chick And Cheese,Restaurant,Korean,"963A1 Lo Gom, P. 8",6,4.05,"47,500"
D6 0479,Tra Sua Co Chan,Restaurant,Thailand,"21 Duong So 11, P. 13",6,4.1,"11,500"
D6 0481,Ly Dong  Am Thuc Trung Hoa & Com Gia Dinh,Bistro,Chinese,"123/2B Binh Tay, P. 1",6,3.4,"115,000"
D6 0487,Tra Tien Huong  Hau Giang,Cafe,Taiwanese,283A Hau Giang,6,4.3,"58,500"
D6 0502,Ha Cao Phat Dat  Pham Van Chi,Bistro,Chinese,"178 Pham Van Chi, P. 4",6,3.95,"32,500"
D6 0517,Kem Bingsu Ice ? Flowers,Cafe,Korean,"D29 Cu Xa Phu Lam B, P. 13",6,4.5,"30,000"
D6 0542,Com Trieu Chau  Hong Bang,Bistro,Chinese,643 Hong Bang,6,3.5,"103,000"
D7 0001,Morico  Contemporary Japanese Lifestyle  Crescent Mall,Restaurant,Japanese,"Tang 2 Crescent Mall, 101 Ton Dat Tien, P. Tan Phu",7,3.95,"235,000"
D7 0002,Papas' Chicken  Phu My Hung,Restaurant,Korean,"S371 Hung Vuong 2, Bui Bang Doan",7,3.5,"265,000"
D7 0003,Sumo BBQ  SC VivoCity  Buffet Nuong & Lau,Restaurant,Japanese,"Tang 2 Lo 02  39 SC Vivo City, 1058 Nguyen Van Linh, KP. 1, P. Tan Phong",7,4.2,"707,000"
D7 0004,Mr.BBQ  Am Thuc Han Quoc,Restaurant,Korean,137 Ton Dat Tien,7,3.6,"480,000"
D7 0006,Seol Hwa  Bingsu Sua Bao Tuyet Hoa  Sky Graden,Cafe,Korean,"28/1 Pham Van Nghi, Khu Pho Sky Garden 1, P. Tan Phong",7,3.95,"270,000"
D7 0007,Shabu Ya  SC VivoCity,Restaurant,Japanese,"Tang 4  SC VivoCity, 1058 Nguyen Van Linh, KP. 1, P. Tan Phong",7,3.8,"490,000"
D7 0008,Galbi Brothers  Nha Hang Han Quoc,Restaurant,Korean,"R1  25 Hung Phuoc 4, Pham Van Nghi, P. Tan Phong",7,3.45,"750,000"
D7 0009,D'Maris  Buffet Cao Cap  Lotte Mart Nam Sai Gon,Restaurant,Korean,"Lau 3 Lotte Mart Nam Sai Gon, 469 Nguyen Huu Tho, P. Tan Hung",7,3.85,"890,000"
D7 0011,Buzza Pizza  Nguyen Thi Thap,Restaurant,Italian,"Tang 1, 51  53 Nguyen Thi Thap, P. Tan Hung",7,4,"208,000"
D7 0012,Marukame Udon  SC VivoCity,Restaurant,Japanese,"Tang 2  SC VivoCity, 1058 Nguyen Van Linh, KP. 1, P. Tan Phong",7,3.7,"230,000"
D7 0013,The Coffee Bean & Tea Leaf  Crescent Mall,Cafe,USA,"101 Nguyen Khac Vien, P. Tan Phu",7,3.9,"180,000"
D7 0014,King BBQ  Vua Nuong Han Quoc  SC VivoCity,Restaurant,Korean,"0405B SC VivoCity, 1058 Nguyen Van Linh, KP. 1, P. Tan Phong",7,3.65,"700,000"
D7 0016,"Yeebo Di Buu  Seafood, Hot Pot & Dimsum  Ho Ban Nguyet",Restaurant,Chinese,"109 Ton Dat Tien, P. Tan Phu",7,3.8,"960,000"
D7 0017,Korean Grill  Buzza BBQ Buffet  Nguyen Thi Thap,Restaurant,Korean,"Tang 3, 51  53 Nguyen Thi Thap, P. Tan Hung",7,4.05,"140,000"
D7 0019,Osaka Ramen Mi Nhat  Phu My Hung,Restaurant,Japanese,"SD04H, 292 My Phat, 133 Nguyen Duc Canh",7,3.75,"175,000"
D7 0024,Friends By Pontian  Mi Singapore  SC VivoCity,Bistro,Singapore,"24A SC VivoCity, 1058 Nguyen Van Linh, KP. 1, P. Tan Phong",7,3.1,"75,000"
D7 0025,Golden Jade Restaurant  SC VivoCity,Restaurant,Chinese,"Tang 1  SC VivoCity, 1058 Nguyen Van Linh, KP. 1, P. Tan Phong",7,3.6,"250,000"
D7 0027,Sinjeon Tokbokki  Am Thuc Han Quoc  Duong So 28,Restaurant,Korean,"92 Duong So 28, P. Tan Phong",7,3.7,"350,000"
D7 0032,Sung Won House  Am Thuc Han Quoc,Restaurant,Korean,"137 Duong So 17, P. Tan Quy",7,3.25,"114,000"
D7 0034,San Fu Lou  Am Thuc Quang Dong  Crescent Mall,Restaurant,Chinese,"Tang Tret Crescent Mall, 101 Ton Dat Tien, P. Tan Phu",7,3.55,"220,000"
D7 0035,Nha Hang Han Quoc Lee Cho  Hung Phuoc 2,Restaurant,Korean,48 Hung Phuoc 2,7,3.7,"430,000"
D7 0036,Mr. Beefsteak  Lam Van Ben,Restaurant,French,"285 Lam Van Ben, P. Tan Quy",7,3.95,"150,000"
D7 0037,Young Dabang  Lau Tokbokki Han Quoc,Bistro,Korean,"143 Nguyen Duc Canh, P. Tan Phong",7,4.05,"640,000"
D7 0040,Awesome Coffee  My Toan 3,Cafe,Asian,"994 Nguyen Van Linh, D2  21 Khu Pho My Toan 3",7,3.9,"160,000"
D7 0042,Uraetei BBQ  Pho Dinh  Hoang Van Thai,Restaurant,Japanese,"73 Hoang Van Thai, P. Tan Phu",7,3.45,"860,000"
D7 0045,Bachutha  Banh Chuoi Thai  Duong So 10,Restaurant,Thailand,"54 Duong So 10, P. Tan Quy",7,3.15,"50,000"
D7 0050,PastaMania  Mi Y & Pizza  Crescent Mall,Restaurant,Italian,"Tang 4  TTTM Crescent Mall (New Wing), 101 Ton Dat Tien, P. Tan Phu",7,3.7,"300,000"
D7 0052,Shahar Cafe Lounge,Bar,Indian,4  1B Khu Mi Kim,7,3.55,"215,000"
D7 0056,Street Sushi  Nguyen Thi Thap,Restaurant,Japanese,"521/3 Nguyen Thi Thap, P. Tan Phong",7,3.3,"135,000"
D7 0061,Jangwon Korean BBQ  Buffet Nuong Ban Da & Lau Han Quoc,Restaurant,Korean,"414 Nguyen Thi Thap, P. Tan Quy",7,3.5,"348,000"
D7 0062,Mi Cay Gochu  Nguyen Thi Thap,Bistro,Korean,156 Nguyen Thi Thap,7,3.15,"110,000"
D7 0064,Mr Champong King  Nha Hang Han Quoc,Restaurant,Korean,"42 Hung Gia 4, P. Tan Phong",7,3.9,"140,000"
D7 0065,Nha Hang Han Quoc Daks,Restaurant,Korean,"SF 8 1 Hung Vuong 3, P. Tan Phong",7,3.85,"270,000"
D7 0068,Burger King  Phu My Hung,Restaurant,USA,"952 Nguyen Van Linh, P. Tan Phong",7,3.05,"201,000"
D7 0070,Vons Chicken,Restaurant,Korean,SC51 KP My Khanh 4,7,3.7,"265,000"
D7 0074,Kochu  Mi Cay  Duong So 17,Bistro,Korean,"153 Duong So 17, P. Tan Quy",7,3.4,"51,000"
D7 0077,KongFo Cha Viet Nam  Duong So 2,Cafe,Taiwanese,"96 Duong So 2, KP. Hung Gia 5, P. Tan Phong",7,3.8,"90,000"
D7 0081,Sushi Hokkaido Sachi ?????  Crescent Mall,Restaurant,Japanese,"GF  29B Crescent Mall, 101 Ton Dat Tien",7,3.85,"650,000"
D7 0084,Tokori BBQ  Nha Hang Nuong Nhat Ban  Nguyen Thi Thap,Restaurant,Japanese,"577 Nguyen Thi Thap, P. Tan Phong",7,4.15,"350,000"
D7 0088,Pizza Origino  French Homemade,Bistro,French,"72A Duong So 4, P. Tan Kieng",7,3.55,"235,000"
D7 0091,Tokyo Sweets,Cafe,Japanese,"Tang 5, Cresent Mall, 101 Ton Dat Tien, Tan Phu",7,3.95,"158,000"
D7 0093,My Sushi House,Bistro,Japanese,"19 Mai Van Vinh, P. Tan Quy",7,3.5,"430,000"
D7 0094,Pizza Inn  Phu My Hung,Restaurant,Italian,"C001 Chung Cu My Phuoc, Pham Thai Buong, P. Tan Phong",7,3.35,"192,000"
D7 0097,Gangnam BBQ  Nuong Han Quoc,Restaurant,Korean,"R248 Phan Khiem Ich, Hung Gia 2",7,3.95,"250,000"
D7 0098,Ba Tofu  Sup Dau Hu Han Quoc,Bistro,Korean,"6062 Cao Trieu Phat, P. Tan Phong",7,4.5,"305,000"
D7 0099,Papaxot  Nguyen Thi Thap,Restaurant,Japanese,427 Nguyen Thi Thap,7,3.3,"148,000"
D7 0101,Subway  RMIT Nguyen Van Linh,Restaurant,USA,702 Nguyen Van Linh,7,3.4,"150,000"
D7 0108,Akatonbo (Chuon Chuon Do)  Ton Dat Tien,Restaurant,Japanese,"195 Ton Dat Tien, P. Tan Phong",7,3.95,"360,000"
D7 0109,Lau Nam Thien Nhien Ashima  Phu My Hung,Restaurant,Japanese,"40 Bui Bang Doan, P. Tan Phong",7,4.65,"435,000"
D7 0111,Kim Korean Food  Duong So 10,Bistro,Korean,"1/10 Duong So 10, P. Tan Quy",7,3.4,"131,000"
D7 0113,Sushi  Lotte Mart Nam Sai Gon,Bistro,Japanese,"Tang Tret Lotte Mart Nam Sai Gon, 469 Nguyen Huu Tho, P. Tan Hung",7,3.4,"104,000"
D7 0114,Hong Kong Town  SC VivoCity,Restaurant,Chinese,"SC VivoCity, 1058 Nguyen Van Linh, KP. 1, P. Tan Phong",7,3.3,"400,000"
D7 0115,Chewy Chewy  Lotte Mart Nam Sai Gon,Bakery,Singapore,"Lo 1F  68, Tang 1 Lotte Mart Nam Sai Gon, 469 Nguyen Huu Tho, P. Tan Hung",7,3.55,"80,000"
D7 0122,Tra Sua R&B Tea  Canh Vien,Cafe,Taiwanese,"17 Pho Tieu Nam, Canh Vien 1, Phu My Hung, P. Tan Phu",7,3.3,"110,000"
D7 0123,BOLLYWOOD INDIAN CUISINE,Restaurant,Indian,"SA 26  2 Sky Garden 2, Phu My Hung",7,3.5,"125,000"
D7 0127,Yen Sushi & Sake Pub  Nguyen Duc Canh,Restaurant,Japanese,"Grand View C, Nguyen Duc Canh",7,4.1,"700,000"
D7 0137,Seoul Deli Phu My Hung,Restaurant,Korean,"S431 Lo R12, Pham Van Nghi, Sky Garden 2, P.Tan Phong",7,3.45,"215,000"
D7 0155,Chang  Modern Thai Cuisine  Nguyen Duc Canh,Restaurant,Thailand,"SB81, My Khanh 2, Nguyen Duc Canh",7,4.15,"350,000"
D7 0157,Shang Garden  Nha Hang Mon Hoa & Mon A,Restaurant,Chinese,"23 Nguyen Khac Vien, P. Tan Phu",7,3.85,"700,000"
D7 0158,Ganesh  Am Thuc An Do  Duong So 6,Restaurant,Indian,"54 Duong So 6, Hung Phuoc 3, P. Tan Phong",7,3.7,"225,000"
D7 0162,Thit Nuong Han Quoc Sky BBQ,Bistro,Korean,"R2  24 Hung Phuoc 2, Cao Trieu Phat",7,4.5,"300,000"
D7 0165,Haidilao Hot Pot  Cresent Mall,Restaurant,Chinese,"Tang 6, Cresent Mall, 101 Ton Dat Tien, P. Tan Phu",7,4.2,"350,000"
D7 0171,Mi Quang Pho Hoi  Nguyen Thi Thap,Bistro,Asian,"380B Nguyen Thi Thap, P. Tan Hung",7,3.75,"70,000"
D7 0179,Shin Po Cha  Am Thuc Han Quoc,Restaurant,Korean,"15 Pham Van Nghi, P. Tan Phong",7,3.55,"375,000"
D7 0183,Gateau De Blanc  Dessert & Cafe  Khu Pho My Tu 3,Cafe,Korean,"35 Khu Pho My Tu 3, P. Tan Phong",7,4.05,"70,000"
D7 0184,DAKBAL SSALON  Chicken,Restaurant,Korean,"R4  77 Hung Gia 4, Phu My Hung",7,3.85,"330,000"
D7 0187,Banh Gao Han Quoc Saeneul,Bistro,Korean,"72 (S351) Pham Van Nghi, Khu Pho Sky Garden 1, P. Tan Phong",7,4,"250,000"
D7 0193,Japanese Udon Donnosuke  Nha Hang Mi Vang Nhat Ban,Restaurant,Japanese,"968 Nguyen Van Linh, P. Tan Phong",7,3.65,"450,000"
D7 0196,Co 5 Thuan  Nem Nuong Ninh Hoa,Restaurant,Asian,"26 Duong 11N, Khu Cu Xa Ngan Hang",7,3.25,"90,000"
D7 0199,Meiwa Hokkaido Ice Cream  SC Vivo City,Cafe,Japanese,"Tang 3 SC Vivo City,1058 Nguyen Van Linh, P. Tan Phong",7,4.3,"139,000"
D7 0203,Ippudo Ramen  Khu Do Thi Nam Thanh Pho,Restaurant,Japanese,"1  3 MD2, Khu A Do Thi Nam Thanh Pho, Nguyen Van Linh, P. Tan Phu",7,4.35,"200,000"
D7 0217,Meat & Meet Korean BBQ Container  Crescent Mall,Restaurant,Korean,"4F  01 Crescent Mall, 101 Ton Dat Tien, P. Tan Phu",7,3.75,"628,000"
D7 0220,The Chicago Jjamppong  Am Thuc Han Quoc,Restaurant,Korean,"35 Dang Duc Thuat, P. Tan Phong",7,4.35,"190,000"
D7 0224,Hao Sua Phap  Le Van Luong,Bistro,French,"96 Le Van Luong, P.Tan Hung",7,3.75,"26,000"
D7 0226,Marduk  Korean Restaurant  Phu My Hung,Restaurant,Korean,"09 Bui Bang Doan, Khu Pho Hung Vuong 2, P. Tan Phong",7,3.7,"910,000"
D7 0229,Kem Cuon Keo Bong  Duong So 15,Cafe,Thailand,"6 Duong So 15, P. Tan Kieng",7,4.3,"33,000"
D7 0234,Royaltea  Tra Sua Hong Kong  Hung Phuoc 2,Cafe,Chinese,"R492 Hung Phuoc 2, P. Tan Phong",7,3.05,"104,000"
D7 0236,Meiwei  Trung Hoa My Vi  SC Vivo City,Restaurant,Asian,"Tang 2, TTTM SC Vivo City, 1058 Nguyen Van Linh",7,3.8,"600,000"
D7 0243,Ilmirack BBQ Restaurant  Nha Hang BBQ Han Quoc,Restaurant,Asian,"222 Pham Thai Buong, P. Tan Phong",7,5,"600,000"
D7 0246,Lac Tra  Nguyen Thi Thap,Cafe,Taiwanese,"316 Nguyen Thi Thap, P. Tan Quy",7,3.65,"75,000"
D7 0248,Bude Chige  Lau Han Quoc,Restaurant,Korean,"55 Duong So 2, Hung Gia 2, P. Tan Phong",7,3.9,"420,000"
D7 0254,Hau Quan  Quan An Dai Loan,Bistro,Taiwanese,"16 Duong So 16, P. Tan Phu",7,3.8,"145,000"
D7 0255,Chill Thai,Restaurant,Thailand,"436B Nguyen Thi Thap, P. Tan Quy",7,4.45,"450,000"
D7 0258,Fat Pie  Dimsum Nga,Bistro,Chinese,"24 Duong N4, Tan Thuan Dong",7,4.3,"114,000"
D7 0260,ChungChun Korean Hotdog Gao,Restaurant,Korean,"84 Duong So 1, P. Tan Phu",7,4.15,"65,000"
D7 0262,Hana BBQ & Hot Pot Buffet  Nguyen Van Linh,Restaurant,Japanese,"1034 Nguyen Van Linh, P. Tan Phong",7,3.8,"550,000"
D7 0264,"Sokocha  Sinh To, Nuoc Ep & Tra Sua",Cafe,Japanese,12 Lam Van Ben,7,4.1,"55,000"
D7 0268,"Geylang Kitchen  Chao Ech, Com Chien & Mi Xao",Bistro,Singapore,"16 Duong So 69, P. Tan Quy",7,3.75,"130,000"
D7 0269,Huong Vi Que Huong  Nha Hang Han Quoc,Restaurant,Korean,49 Cao Trieu Phat,7,4,"280,000"
D7 0272,"Xao Noodle  Hu Tieu, Pho Xao & Pad Thai",Bistro,Asian,"401 Tran Xuan Soan, P. Tan Kieng",7,4.15,"105,000"
D7 0274,Le Sable  Mom 'N Kids Cafe,Cafe,Korean,"S582 Tang 2 Sky Garden 3, Pham Van Nghi, P. Tan Phong",7,4.05,"90,000"
D7 0284,Deutsches Eck Restaurant & Pub  Mon Duc,Restaurant,Germany,"A0103 Hung Vuong 1, Phu My Hung",7,3.75,"480,000"
D7 0290,Quan An Han Quoc  Hung Phuoc 4,Restaurant,Korean,R4 2 Hung Phuoc 4,7,3.85,"430,000"
D7 0292,Genki Sushi  Take Away & Delivery,Restaurant,Japanese,"10 Ben Nghe, P. Tan Thuan Dong",7,4.05,"180,000"
D7 0297,Meat Heaven BBQ,Restaurant,Korean,"R4  23, R2  24 Hung Phuoc 4, Duong So 6, P. Tan Phong",7,4.1,"700,000"
D7 0317,YeolKwang  Am Thuc Han Quoc,Restaurant,Korean,"34 Hung Gia 4, P. Tan Phong",7,3.8,"680,000"
D7 0324,Tra Sua Mizusawa  Duong C,Cafe,Japanese,"20 Duong C, Khu Canh Vien 2, P. Tan Phu",7,3.65,"115,000"
D7 0330,Co Giang  Dac San Mien Trung  Duong So 29,Bistro,Asian,"50 Duong So 29, P. Tan Kieng",7,3.1,"65,000"
D7 0332,Churros & Pops  Lotte Mart Nam Sai Gon,Cafe,Spanish,"Tang 3 Khu Vui Choi Lotte Mart Nam Sai Gon, 469 Nguyen Huu Tho, P. Tan Hung",7,3.8,"37,000"
D7 0338,Chao Ech Singapore,Bistro,Singapore,72A Duong So 79,7,3.9,"55,000"
D7 0339,Club House Saigon  Sang Tao,Restaurant,French,"Sang Tao, P. Tan Thuan",7,4,"450,000"
D7 0340,Sora Menya  Mi Ramen & Com Nhat  Crescent Mall,Bistro,Japanese,"Lau 4 Food Court, Crescent Mall, 101 Ton Dat Tien, P. Tan Phu",7,4.1,"180,000"
D7 0341,Chao Ech Thanh Tu,Bistro,Singapore,"77 Nguyen Huu Tho, P. Tan Hung",7,3.25,"85,000"
D7 0346,Tokbokki  Banh Gao Cay,Restaurant,Korean,"Doi Dien Lotte Mart, Nguyen Thi Thap, P. Tan Hung",7,3.6,"70,000"
D7 0350,Takoyaki,Restaurant,Japanese,"Chung Cu Hoang Anh Gia Lai, Nguyen Thi Thap",7,3.5,"30,000"
D7 0364,Tram Nam  Nha Hang Han Quoc,Restaurant,Korean,"R4  47.48 Hung Phuoc 3, Duong So 6, P",7,4.75,"550,000"
D7 0372,Ty Ky Mi Gia  Le Thi Cho,Bistro,Chinese,"1333/41 Le Thi Cho, P. Phu Thuan",7,3.15,"80,000"
D7 0375,Cajun Cua  Nguyen Huu Tho,Restaurant,USA,"X01.14 Vietnam Sunrise City, 27 Nguyen Huu Tho, P. Tan Hung",7,3.75,"480,000"
D7 0376,5elements  Chatime  SC VivoCity,Cafe,Chinese,"Tang 2  SC VivoCity, 1058 Nguyen Van Linh, KP. 1, P. Tan Phong",7,4.25,"150,000"
D7 0381,Goobne Chicken  Ga Nuong Lo Han Quoc  Nguyen Thi Thap,Restaurant,Korean,"99 Nguyen Thi Thap, P. Tan Hung",7,3.35,"400,000"
D7 0387,Molten La Cake  Nguyen Thi Thap,Bakery,Asian,118/6 Nguyen Thi Thap,7,4,"185,000"
D7 0389,Nha Hang The Tavern  Phan Khiem Ich,Restaurant,Asian,"47 Phan Khiem Ich, P. Tan Phong",7,4.8,"430,000"
D7 0391,Miko  Hotdog & Tokbokki  Shop Online,Restaurant,Korean,"588/37/6/2A Huynh Tan Phat, P. Tan Phu",7,3.75,"65,000"
D7 0400,Johnson Budae Tteokbokki  Crescent Mall,Restaurant,Korean,"Tang 4, Tang 4, Crescent Mall, 101 Ton Dat Tien, P. Tan Phu",7,3.45,"138,000"
D7 0417,Chao Chicken  Ga Ran Han Quoc,Restaurant,Korean,"56 Le Van Thiem, P. Tan Phong",7,4.2,"330,000"
D7 0422,VIIIRe  Italian Restaurant,Restaurant,Italian,"2123 Hung Phuoc 2, P. Tan Phong",7,4.05,"930,000"
D7 0423,Tiem Banh Cung Dinh  Han Quoc,Bakery,Korean,"R3  36 Hung Phuoc 4 Duong So 6, P.Tan Phong",7,4.15,"325,000"
D7 0435,The Green House Restaurant  Canh Vien,Bistro,Asian,"SF 101 Canh Vien 1, Tieu Nam, P. Tan Phu",7,3.95,"640,000"
D7 0439,Love Me Tender,Restaurant,Korean,"Sky Garden 2, S361, Pham Van Nghi  Bac, P. Tan Phong",7,4.15,"548,000"
D7 0443,Pizza Tonda Vietnam  Duong 17,Restaurant,Italian,"53 Duong 17, Khu Pho My Thai 2, P. Tan Phu",7,3.55,"314,000"
D7 0449,Sushi One,Restaurant,Japanese,"42 Hoang Trong Mau, P. Tan Hung",7,4.05,"535,000"
D7 0451,OLA Tea House  Duong So 15B,Cafe,Taiwanese,23  25  27 Duong So 15B,7,3.4,"70,000"
D7 0460,GAXEO Chicken  Beer & BBQ  SC VivoCity,Restaurant,Korean,"Tang 5 Lo 05  04 SC VivoCity, 1058 Nguyen Van Linh, P. Tan Phong",7,3,"300,000"
D7 0471,Com Ga Xoi Mo Dai Loan  Tran Xuan Soan,Bistro,Chinese,"KA36 Tran Xuan Soan, P. Tan Thuan Tay",7,3.6,"55,000"
D7 0483,Jung Da Yul  Fusion Zzambbong & Pizza,Restaurant,Korean,"27  1 Pham Van Nghi  Bac, KP Sky Garden 1, P. Tan Phong",7,4.1,"210,000"
D7 0485,Back's Burger,Restaurant,Asian,"S42  1 Sky Garden 2, Pham Van Nghi",7,4.25,"170,000"
D7 0486,Yin's Kitchen  Hong Kong Dessert  Shop Online,Restaurant,Chinese,"Tang 6 Chung Cu Full House, 80 Duong So 3, P. Tan Kieng",7,4.3,"70,000"
D7 0489,Su Bin  Chao Ech Singapore  Duong D4,Bistro,Singapore,"B19 Duong D4, P. Tan Hung",7,3.5,"70,000"
D7 0490,Chivago Chicken  Ga Ran Han Quoc & Bia  Nguyen Thi Thap,Bistro,Korean,"318 Nguyen Thi Thap, P. Tan Quy",7,3.85,"600,000"
D7 0492,Aceline Bakery,Bakery,Japanese,"S85  1 Sky Garden 3, Pham Van Nghi, P. Tan Phong",7,3.4,"65,000"
D7 0496,Banh Gao Cay Oppa Tokbokki  Chung Cu Scenic Valley 1,Restaurant,Korean,"Block I Cong So 3, Chung Cu Scenic Valley 1, Ton Dat Tien, P. Tan Phu",7,4.3,"145,000"
D8 0001,Shinsen Sushi  Au Duong Lan,Restaurant,Japanese,"178 Au Duong Lan, P. 3",8,3.4,"57,500"
D8 0006,Papaxot  Pham Hung,Restaurant,Japanese,"8A Pham Hung, P. 4",8,3.65,"102,500"
D8 0015,Xuc Xich Duc Anh Ba Tay  Duong Ba Trac,Restaurant,Germany,"174 Duong Ba Trac, P. 2",8,3.85,"107,500"
D8 0016,Sobin  Mi Cay & Tra Sua,Bistro,Korean,"45T Duong Ba Trac, P. 1",8,4,"50,000"
D8 0020,Quan Bangkok  Hu Tieu Thai,Bistro,Thailand,"131 Mac Van, P. 12",8,3.35,"48,000"
D8 0025,Bao Boi  Banh Bao Hawaii  Au Duong Lan Noi Dai,Restaurant,USA,"14 Au Duong Lan Noi Dai, P. 1",8,4.3,"18,500"
D8 0027,Sushi Co Chu Hoa Mai  Hung Phu,Restaurant,Japanese,"578/28 Hung Phu, P. 9",8,3.1,"295,000"
D8 0030,Mi Cay Gochu  Ta Quang Buu,Bistro,Korean,"924A Ta Quang Buu, P. 5",8,3.3,"25,000"
D8 0041,Ramyon Sarang  Mi Cay Han Quoc,Bistro,Korean,"932B Ta Quang Buu, P. 5",8,4,"45,000"
D8 0047,Nha Hang Flame  Am Thuc Viet,Restaurant,Asian,"392 Pham Hung, P. 5",8,3.15,"92,500"
D8 0053,Pad Thai Tom  Mon Thai Ngon  Shop Online,Bistro,Thailand,"1587 Pham The Hien, P. 6",8,4.6,"57,500"
D8 0059,Tito  Mi Cay 7 Cap Do,Bistro,Korean,"254 Nguyen Duy, P. 9",8,3.9,"31,500"
D8 0069,CoCha Milk Tea & Coffee,Cafe,Taiwanese,"174 Au Duong Lan, P. 3",8,4.45,"36,500"
D8 0071,Pizza Hut  Pham Hung,Restaurant,USA,"364 Pham Hung (Doi Dien Nha Tho Nam Hai), P. 5",8,3.35,"240,000"
D8 0079,Ming Cha Milktea,Cafe,Taiwanese,"212 Duong Ba Trac, P. 2",8,3.9,"37,000"
D8 0086,Com Ga Singapore  Pham The Hien,Bistro,Singapore,"600 Pham The Hien, P. 4",8,4,"177,500"
D8 0094,Phuc Sushi,Bistro,Japanese,"Hem 696 So 20 Lo 10 Hung Phu, P. 10",8,4.95,"37,500"
D8 0098,Jeju Quan  Mon An Han Quoc,Bistro,Korean,"167 Ta Quang Buu, P. 3",8,3.6,"50,500"
D8 0105,Nami Detox Water  Shop Online,Restaurant,USA,"8 Cao Lo, P. 4",8,3.65,"105,000"
D8 0108,Sai Gon Givral Bakery  Pham Hung,Bakery,French,"322 Pham Hung, P. 5",8,3.35,"32,500"
D8 0115,Mi Cay Seoul  Duong Quang Dong,Bistro,Korean,"90 Duong Quang Dong, P. 5",8,3.25,"55,000"
D8 0123,Tran Bao Spaghetti,Bistro,Italian,"122 Ta Quang Buu, P. 3",8,4.3,"25,000"
D8 0124,"4 Seasons Coffee & Tea, Bun Bo Hue",Cafe,USA,"866B Ta Quang Buu, Phuong 5",8,3.6,"42,500"
D8 0128,The Oyaizu Matcha  Coffee Matcha  Au Duong Lan,Cafe,Japanese,"178 Au Duong Lan, P. 3",8,3.6,"55,000"
D8 0144,8 Boat Noodle Saigon  Mi Thai,Bistro,Thailand,"142 Duong Ba Trac, P. 2",8,4,"40,000"
D8 0147,Sushi Go Deee,Bistro,Japanese,"51 Ta Quang Buu, P. 2",8,3.5,"62,500"
D8 0150,SaSin  Mi Cay 7 Cap Do Han Quoc  Ta Quang Buu,Bistro,Korean,"833A Ta Quang Buu, P. 5",8,3.6,"47,500"
D8 0154,Sukiya  Com Bo Ham & Mi Ramen  Ta Quang Buu,Restaurant,Japanese,"860 Ta Quang Buu, P. 5",8,4,"57,000"
D8 0163,Bep Dinh Duong  Com Vi Nguoi Hoa  Shop Online,Restaurant,Chinese,"75/4 Phong Phu, P. 11",8,4.6,"35,000"
D8 0171,Com Ga A Thon  Tuy Ly Vuong,Bistro,Chinese,"127 Tuy Ly Vuong, P. 12",8,4,"30,000"
D8 0181,Tra Sua Kool Break,Cafe,Thailand,"214 Duong So 10, P. 4",8,4.35,"20,000"
D8 0222,Tom Sot Singapore,Bistro,Singapore,191  193 Ta Quang Buu,8,4.2,"12,500"
D8 0236,Banh Trung Ga Non,Restaurant,Chinese,"100A/35 Duong Ba Trac, P. 2",8,4.2,"20,000"
D8 0247,Big Sushi World,Bistro,Japanese,"57/30 Bong Sao, P. 5",8,4.1,"260,000"
D8 0256,Nam Hai Duong  Vi Ca & Yen Sao  Tung Thien Vuong,Restaurant,Chinese,"355 Tung Thien Vuong, P. 12",8,4.45,"175,000"
D8 0260,Pho Vinh  Nguyen Van Cua,Bistro,Chinese,"Via He 37 Nguyen Van Cua, P. 13",8,3.3,"25,000"
D8 0291,Kai Tea  De Nhat Tra Sua Tuoi  Pham Hung,Cafe,Asian,"222 Pham Hung, P. 5",8,4,"36,500"
D8 0295,Sam Co  Com Ga Quang Dong,Bistro,Chinese,"39 Nguyen Quyen, P. 11",8,4.45,"40,500"
D8 0305,"Tuyetfood  Bo Kho & My Y Bo My, Uc",Bistro,Australian,"Block B Chung Cu Diamond Riverside, 1646A Vo Van Kiet, P. 16",8,3.45,"59,000"
D8 0343,Tra Sua R&B Tea  Hung Phu,Cafe,Taiwanese,"526 Hung Phu, P. 9",8,4.05,"57,500"
D8 0407,Banh Mi Kebab Nhan +,Restaurant,American,"142 Duong Ba Trac, P. 2",8,3.95,"21,500"
D8 0426,Takoyaki Sushi  Ta Quang Buu,Bistro,Japanese,"886 Ta Quang Buu, P. 5",8,4,"50,000"
D8 0447,King Bo Ne  Bong Sao,Bistro,Asian,"51 Duong 320, KDC Bong Sao, P. 5",8,4.4,"45,000"
D8 0465,Sun  Mon Han,Bistro,Korean,"9/21 Cao Lo, P. 4",8,3.5,"81,500"
D8 0472,Mi Y Ba Xa,Restaurant,Italian,"125/158 D4 Nguyen Thi Tan, P. 2",8,4.3,"27,500"
D8 0475,An Vat Rach U Cay  Shop Online,Restaurant,Asian,"180 Ba Dinh, P. 10",8,3.3,"57,500"
D8 0511,Banh Mi Kebab Anna  Duong Ba Trac,Bakery,American,"140 Duong Ba Trac, P. 2",8,4,"18,000"
D8 0537,Banh Gao Cay,Restaurant,Korean,"258/32 Duong Ba Trac, P. 2",8,4.1,"18,500"
D8 0544,Mi Y,Bistro,Italian,173 Pham Hung,8,3.6,"15,000"
D9 0001,Gogi House  Quan Nuong Han Quoc  Vincom Le Van Viet,Bistro,Korean,"Tang L402 Vincom Le Van Viet, 50 Le Van Viet, P. Hiep Phu",9,4.05,"400,000"
D9 0004,King BBQ  Vua Nuong Han Quoc  Vincom Le Van Viet,Restaurant,Korean,"Vincom Le Van Viet, 50 Le Van Viet, P. Hiep Phu",9,3.8,"350,000"
D9 0007,Grill & Cheer  Buffet Nuong & Lau   TTTM Vincom Le Van Viet,Restaurant,Korean,"50 Le Van Viet, Phuong Hiep Phu",9,3.8,"219,000"
